{
  "description": "The fleet's default arming policy. Each organisation's agent-fabric-settings repository (projects/registry.json settings_repos) holds repos/<repo>.json, which overrides this per repository: objects merge recursively, scalars replace. The shape is identities/schemas/arming.schema.json. Below the minimum of work commits a PR is armed only on the owner's word, or on the word of the role commits.below_min_authority names (commits.boundary_authority for a security-boundary change; agent-fabric ADR-019 rule 4); the 8 and 16 are the minimum and the size above which the gate advises splitting; boundary_min is the security boundary's own minimum, which no repository lowers. reviews lists the engines (claude, codex) whose review of the current head a PR needs, boundary_reviews the engines a security-boundary change needs as well (agent-fabric ADR-053 rule 6); a list replaces. additional_reviews lists engines that review when they can and never block: codex, whose review or unavailable marker for the head the arm accepts (the owner, 2026-10-13: \"codex is more, not a blocking\"). The fleet lists codex here: the tool that posts its unavailable marker has landed (#245), so a codex that cannot run no longer stops an arm; one that left neither a review nor a marker for the head is absent, and the arm proceeds on the required reviews and says so (agent-fabric ADR-055 rule 8). armed_status is the status context fabric-pr arm posts on the head its gates read before it enables auto-merge; in mode auto the ruleset requires it in addition to required_checks (not through that list, which a repository's own replaces), so a head pushed after an arming never merges on it (audit F02); null turns it off for a repository.",
  "mode": "auto",
  "method": "merge",
  "required_checks": [],
  "signatures": true,
  "protect": {
    "deletion": true,
    "force_push": true
  },
  "delete_branch_on_merge": false,
  "queue": {},
  "commits": {
    "min": 8,
    "advice_over": 16,
    "boundary_min": 8,
    "below_min": "owner-word",
    "roles": {},
    "classes": {}
  },
  "reviews": [
    "claude"
  ],
  "boundary_reviews": [
    "claude"
  ],
  "additional_reviews": [
    "codex"
  ],
  "bots": {},
  "github": {
    "ruleset": "fabric arming policy"
  },
  "armed_status": "fabric/armed"
}
